{"grao":"1 linha por subconjunto de segmentos × nó × par com o nó (os 10 de maior lift); período 4s","dimensoes":{"subconjunto":["todos","Fiéis","Regulares","Fiéis+Regulares","Fiéis+Esporádicos","Regulares+Esporádicos","Fiéis+Regulares+Esporádicos","Fiéis+Em pausa","Regulares+Em pausa","Fiéis+Regulares+Em pausa","Fiéis+Esporádicos+Em pausa","Regulares+Esporádicos+Em pausa","Fiéis+Regulares+Esporádicos+Em pausa"]},"colunas":["subconjunto","no","outro","cestas_par","confianca","lift","indice"],"linhas":[[0,0,5,986,0.3264,1.7441,1.0],[0,0,33,444,0.147,1.7143,1.0],[0,0,43,293,0.097,1.675,1.0],[0,0,35,364,0.1205,1.6399,1.0],[0,0,30,353,0.1168,1.6381,1.0],[0,0,6,552,0.1827,1.6215,1.0],[0,0,53,352,0.1165,1.588,1.0],[0,0,36,369,0.1221,1.5808,1.0],[0,0,74,209,0.0692,1.5728,1.0],[0,0,63,264,0.0874,1.5617,1.0],[0,1,16,315,0.1813,3.2924,1.0],[0,1,63,319,0.1836,3.2821,1.0],[0,1,43,303,0.1744,3.0127,1.0],[0,1,23,554,0.3189,2.903,1.0],[0,1,41,336,0.1934,2.9018,1.0],[0,1,14,319,0.1836,2.8294,1.0],[0,1,47,240,0.1382,2.741,1.0],[0,1,35,342,0.1969,2.6798,1.0],[0,1,39,330,0.19,2.678,1.0],[0,1,58,278,0.16,2.6569,1.0],[0,2,9,838,0.2648,2.2338,1.0],[0,2,63,369,0.1166,2.0836,1.0],[0,2,51,849,0.2682,2.0679,1.0],[0,2,43,378,0.1194,2.0626,1.0],[0,2,48,438,0.1384,2.061,1.0],[0,2,30,463,0.1463,2.0508,1.0],[0,2,29,513,0.1621,2.0462,1.0],[0,2,35,466,0.1472,2.004,1.0],[0,2,68,328,0.1036,1.998,1.0],[0,2,20,637,0.2013,1.9772,1.0],[0,3,63,360,0.1642,2.9351,1.0],[0,3,55,532,0.2427,2.7991,1.0],[0,3,39,427,0.1948,2.7459,1.0],[0,3,32,201,0.0917,2.5675,1.0],[0,3,43,321,0.1464,2.5291,1.0],[0,3,29,439,0.2003,2.5283,1.0],[0,3,35,404,0.1843,2.5085,1.0],[0,3,53,396,0.1807,2.4621,1.0],[0,3,68,272,0.1241,2.3924,1.0],[0,3,21,573,0.2614,2.392,1.0],[0,4,6,346,0.3252,2.8857,1.0],[0,4,30,202,0.1898,2.6615,1.0],[0,4,35,205,0.1927,2.6223,1.0],[0,4,13,250,0.235,2.3306,1.0],[0,4,21,270,0.2538,2.322,1.0],[0,4,17,233,0.219,2.2458,1.0],[0,4,10,290,0.2726,2.2071,1.0],[0,4,33,201,0.1889,2.2034,1.0],[0,4,23,249,0.234,2.13,1.0],[0,4,20,225,0.2115,2.0775,1.0],[0,5,39,346,0.1799,2.5363,1.0],[0,5,43,263,0.1368,2.362,1.0],[0,5,55,388,0.2018,2.327,1.0],[0,5,35,325,0.169,2.3003,1.0],[0,5,30,315,0.1638,2.2964,1.0],[0,5,11,314,0.1633,2.2583,1.0],[0,5,6,473,0.246,2.1827,1.0],[0,5,63,232,0.1206,2.1561,1.0],[0,5,53,298,0.155,2.112,1.0],[0,5,47,204,0.1061,2.1045,1.0],[0,6,43,210,0.1813,3.132,1.0],[0,6,30,253,0.2185,3.0629,1.0],[0,6,4,346,0.2988,2.8857,1.0],[0,6,35,239,0.2064,2.8091,1.0],[0,6,21,317,0.2737,2.5049,1.0],[0,6,33,240,0.2073,2.4174,1.0],[0,6,36,215,0.1857,2.4029,1.0],[0,6,13,275,0.2375,2.3555,1.0],[0,6,9,321,0.2772,2.3387,1.0],[0,6,10,317,0.2737,2.2167,1.0],[0,7,11,486,0.1826,2.525,1.0],[0,7,43,370,0.139,2.4005,1.0],[0,7,68,330,0.124,2.39,1.0],[0,7,35,461,0.1732,2.3571,1.0],[0,7,13,630,0.2367,2.3475,1.0],[0,7,27,200,0.0751,2.3185,1.0],[0,7,63,345,0.1296,2.3162,1.0],[0,7,32,220,0.0826,2.314,1.0],[0,7,30,432,0.1623,2.2751,1.0],[0,7,48,406,0.1525,2.2714,1.0],[0,8,3,228,0.3551,1.6649,1.0],[0,8,0,224,0.3489,1.1868,1.0],[0,8,2,203,0.3162,1.0266,1.0],[0,9,30,318,0.2611,3.6602,1.0],[0,9,43,212,0.1741,3.006,1.0],[0,9,63,203,0.1667,2.9786,1.0],[0,9,48,239,0.1962,2.9223,1.0],[0,9,58,202,0.1658,2.7532,1.0],[0,9,36,253,0.2077,2.6883,1.0],[0,9,35,238,0.1954,2.6595,1.0],[0,9,29,253,0.2077,2.6222,1.0],[0,9,17,307,0.2521,2.5849,1.0],[0,9,10,372,0.3054,2.4732,1.0],[0,10,43,255,0.2009,3.4704,1.0],[0,10,63,232,0.1828,3.2673,1.0],[0,10,35,301,0.2372,3.2284,1.0],[0,10,58,244,0.1923,3.192,1.0],[0,10,48,270,0.2128,3.1687,1.0],[0,10,21,431,0.3396,3.1078,1.0],[0,10,23,428,0.3373,3.0698,1.0],[0,10,40,222,0.1749,2.7321,1.0],[0,10,14,224,0.1765,2.7195,1.0],[0,10,30,235,0.1852,2.5961,1.0],[0,11,34,308,0.4145,8.4856,1.0],[0,11,7,486,0.6541,2.525,1.0],[0,11,23,201,0.2705,2.4623,1.0],[0,11,57,266,0.358,2.4608,1.0],[0,11,5,314,0.4226,2.2583,1.0],[0,11,10,206,0.2773,2.2451,1.0],[0,11,3,355,0.4778,2.2399,1.0],[0,11,51,207,0.2786,2.1477,1.0],[0,11,1,261,0.3513,2.0781,1.0],[0,11,2,418,0.5626,1.8266,1.0],[0,13,35,220,0.2124,2.8903,1.0],[0,13,30,203,0.1959,2.747,1.0],[0,13,33,228,0.2201,2.567,1.0],[0,13,55,225,0.2172,2.5048,1.0],[0,13,21,281,0.2712,2.4819,1.0],[0,13,3,527,0.5087,2.3847,1.0],[0,13,9,291,0.2809,2.3698,1.0],[0,13,6,275,0.2654,2.3555,1.0],[0,13,7,630,0.6081,2.3475,1.0],[0,13,4,250,0.2413,2.3306,1.0],[0,14,23,220,0.3298,3.0021,1.0],[0,14,1,319,0.4783,2.8294,1.0],[0,14,10,224,0.3358,2.7195,1.0],[0,14,51,203,0.3043,2.3462,1.0],[0,14,3,318,0.4768,2.235,1.0],[0,14,57,211,0.3163,2.1744,1.0],[0,14,7,349,0.5232,2.0198,1.0],[0,14,2,365,0.5472,1.7767,1.0],[0,14,5,202,0.3028,1.6183,1.0],[0,14,0,248,0.3718,1.2647,1.0],[0,15,21,204,0.1717,1.5713,1.0],[0,15,5,322,0.271,1.4484,1.0],[0,15,10,200,0.1684,1.3633,1.0],[0,15,3,342,0.2879,1.3496,1.0],[0,15,57,229,0.1928,1.325,1.0],[0,15,7,384,0.3232,1.2478,1.0],[0,15,2,455,0.383,1.2435,1.0],[0,15,1,248,0.2088,1.235,1.0],[0,15,0,425,0.3577,1.2169,1.0],[0,16,1,315,0.5565,3.2924,1.0],[0,16,7,309,0.5459,2.1075,1.0],[0,16,3,248,0.4382,2.0541,1.0],[0,16,2,299,0.5283,1.7152,1.0],[0,16,0,238,0.4205,1.4303,1.0],[0,17,30,229,0.2285,3.204,1.0],[0,17,48,203,0.2026,3.0172,1.0],[0,17,23,294,0.2934,2.6706,1.0],[0,17,29,207,0.2066,2.608,1.0],[0,17,9,307,0.3064,2.5849,1.0],[0,17,10,312,0.3114,2.5214,1.0],[0,17,21,266,0.2655,2.4292,1.0],[0,17,20,236,0.2355,2.3139,1.0],[0,17,4,233,0.2325,2.2458,1.0],[0,17,57,316,0.3154,2.1677,1.0],[0,18,57,208,0.2584,1.776,1.0],[0,18,2,411,0.5106,1.6577,1.0],[0,18,1,225,0.2795,1.6535,1.0],[0,18,3,281,0.3491,1.6364,1.0],[0,18,7,339,0.4211,1.6256,1.0],[0,18,5,244,0.3031,1.6197,1.0],[0,18,0,312,0.3876,1.3184,1.0],[0,19,3,218,0.4052,1.8996,1.0],[0,19,7,259,0.4814,1.8584,1.0],[0,19,2,307,0.5706,1.8527,1.0],[0,20,29,226,0.2161,2.7276,1.0],[0,20,17,236,0.2256,2.3139,1.0],[0,20,51,310,0.2964,2.2847,1.0],[0,20,33,201,0.1922,2.2414,1.0],[0,20,57,337,0.3222,2.2145,1.0],[0,20,6,253,0.2419,2.1464,1.0],[0,20,10,276,0.2639,2.1367,1.0],[0,20,23,241,0.2304,2.0971,1.0],[0,20,9,259,0.2476,2.089,1.0],[0,20,4,225,0.2151,2.0775,1.0],[0,21,43,214,0.1906,3.2911,1.0],[0,21,30,249,0.2217,3.1084,1.0],[0,21,10,431,0.3838,3.1078,1.0],[0,21,48,230,0.2048,3.0502,1.0],[0,21,35,251,0.2235,3.0421,1.0],[0,21,36,262,0.2333,3.0194,1.0],[0,21,58,200,0.1781,2.9565,1.0],[0,21,23,360,0.3206,2.9178,1.0],[0,21,50,220,0.1959,2.6877,1.0],[0,21,53,212,0.1888,2.5728,1.0],[0,23,48,300,0.2657,3.9573,1.0],[0,23,58,256,0.2267,3.7643,1.0],[0,23,43,245,0.217,3.7478,1.0],[0,23,63,234,0.2073,3.7041,1.0],[0,23,41,248,0.2197,3.2953,1.0],[0,23,40,230,0.2037,3.1815,1.0],[0,23,35,261,0.2312,3.1465,1.0],[0,23,39,249,0.2205,3.1089,1.0],[0,23,10,428,0.3791,3.0698,1.0],[0,23,53,254,0.225,3.0661,1.0],[0,24,1,226,0.3675,2.174,1.0],[0,24,7,326,0.5301,2.0462,1.0],[0,24,3,245,0.3984,1.8676,1.0],[0,24,5,212,0.3447,1.8421,1.0],[0,24,2,342,0.5561,1.8055,1.0],[0,24,0,243,0.3951,1.344,1.0],[0,25,57,222,0.281,1.9316,1.0],[0,25,5,263,0.3329,1.779,1.0],[0,25,3,287,0.3633,1.7031,1.0],[0,25,7,331,0.419,1.6174,1.0],[0,25,2,363,0.4595,1.4919,1.0],[0,25,0,318,0.4025,1.3692,1.0],[0,27,7,200,0.6006,2.3185,1.0],[0,29,57,357,0.4386,3.0146,1.0],[0,29,20,226,0.2776,2.7276,1.0],[0,29,9,253,0.3108,2.6222,1.0],[0,29,17,207,0.2543,2.608,1.0],[0,29,21,228,0.2801,2.563,1.0],[0,29,3,439,0.5393,2.5283,1.0],[0,29,10,253,0.3108,2.5169,1.0],[0,29,51,258,0.317,2.4434,1.0],[0,29,23,216,0.2654,2.4152,1.0],[0,29,6,203,0.2494,2.213,1.0],[0,30,9,318,0.4338,3.6602,1.0],[0,30,17,229,0.3124,3.204,1.0],[0,30,21,249,0.3397,3.1084,1.0],[0,30,6,253,0.3452,3.0629,1.0],[0,30,23,231,0.3151,2.8684,1.0],[0,30,13,203,0.2769,2.747,1.0],[0,30,57,287,0.3915,2.6913,1.0],[0,30,4,202,0.2756,2.6615,1.0],[0,30,10,235,0.3206,2.5961,1.0],[0,30,3,372,0.5075,2.3792,1.0],[0,32,3,201,0.5477,2.5675,1.0],[0,32,7,220,0.5995,2.314,1.0],[0,32,2,213,0.5804,1.8844,1.0],[0,33,35,203,0.2304,3.1362,1.0],[0,33,13,228,0.2588,2.567,1.0],[0,33,21,234,0.2656,2.4304,1.0],[0,33,6,240,0.2724,2.4174,1.0],[0,33,9,244,0.277,2.3366,1.0],[0,33,20,201,0.2281,2.2414,1.0],[0,33,4,201,0.2281,2.2034,1.0],[0,33,7,489,0.5551,2.1426,1.0],[0,33,10,233,0.2645,2.1416,1.0],[0,33,23,205,0.2327,2.1179,1.0],[0,34,11,308,0.6135,8.4856,1.0],[0,34,7,295,0.5876,2.2685,1.0],[0,34,3,225,0.4482,2.1012,1.0],[0,34,2,292,0.5817,1.8886,1.0],[0,34,0,220,0.4382,1.4907,1.0],[0,35,43,233,0.3086,5.3299,1.0],[0,35,10,301,0.3987,3.2284,1.0],[0,35,23,261,0.3457,3.1465,1.0],[0,35,33,203,0.2689,3.1362,1.0],[0,35,21,251,0.3325,3.0421,1.0],[0,35,13,220,0.2914,2.8903,1.0],[0,35,6,239,0.3166,2.8091,1.0],[0,35,1,342,0.453,2.6798,1.0],[0,35,9,238,0.3152,2.6595,1.0],[0,35,4,205,0.2715,2.6223,1.0],[0,36,21,262,0.33,3.0194,1.0],[0,36,9,253,0.3186,2.6883,1.0],[0,36,23,211,0.2657,2.4188,1.0],[0,36,10,236,0.2972,2.4069,1.0],[0,36,6,215,0.2708,2.4029,1.0],[0,36,57,265,0.3338,2.2941,1.0],[0,36,5,310,0.3904,2.0863,1.0],[0,36,7,414,0.5214,2.0128,1.0],[0,36,3,332,0.4181,1.9602,1.0],[0,36,1,263,0.3312,1.9596,1.0],[0,39,55,238,0.3265,3.7653,1.0],[0,39,23,249,0.3416,3.1089,1.0],[0,39,3,427,0.5857,2.7459,1.0],[0,39,1,330,0.4527,2.678,1.0],[0,39,5,346,0.4746,2.5363,1.0],[0,39,10,223,0.3059,2.4771,1.0],[0,39,9,212,0.2908,2.4535,1.0],[0,39,57,236,0.3237,2.2252,1.0],[0,39,7,343,0.4705,1.8163,1.0],[0,39,2,377,0.5171,1.6791,1.0],[0,40,23,230,0.3495,3.1815,1.0],[0,40,10,222,0.3374,2.7321,1.0],[0,40,1,285,0.4331,2.5624,1.0],[0,40,57,232,0.3526,2.4235,1.0],[0,40,51,201,0.3055,2.3549,1.0],[0,40,3,312,0.4742,2.2229,1.0],[0,40,7,369,0.5608,2.1648,1.0],[0,40,5,212,0.3222,1.7217,1.0],[0,40,2,330,0.5015,1.6283,1.0],[0,40,0,273,0.4149,1.4113,1.0],[0,41,23,248,0.362,3.2953,1.0],[0,41,1,336,0.4905,2.9018,1.0],[0,41,10,216,0.3153,2.5534,1.0],[0,41,57,254,0.3708,2.5487,1.0],[0,41,51,212,0.3095,2.3858,1.0],[0,41,3,314,0.4584,2.1489,1.0],[0,41,7,378,0.5518,2.1302,1.0],[0,41,2,414,0.6044,1.9623,1.0],[0,41,5,232,0.3387,1.8098,1.0],[0,41,0,276,0.4029,1.3705,1.0],[0,42,51,213,0.3272,2.5223,1.0],[0,42,1,254,0.3902,2.3082,1.0],[0,42,3,318,0.4885,2.29,1.0],[0,42,7,329,0.5054,1.9509,1.0],[0,42,5,228,0.3502,1.8715,1.0],[0,42,2,366,0.5622,1.8254,1.0],[0,42,0,277,0.4255,1.4473,1.0],[0,43,35,233,